[
  {
    "country": "United States",
    "system": "College letter grades (4.0 GPA, plus/minus)",
    "grade": "A+",
    "min_percent": null,
    "max_percent": null,
    "gpa_points": 4.0,
    "description": "Excellent (plus)",
    "source_url": "https://sps.columbia.edu/students/student-advising/academic-policies-procedures/grades",
    "notes": "No common percentage cutoff (null): many schools do not award A+, and those that do set their own cutoff (Columbia SPS uses 98-100). Most schools count A+ as 4.0; some (e.g. Columbia SPS, Arizona State) give 4.33."
  },
  {
    "country": "United States",
    "system": "College letter grades (4.0 GPA, plus/minus)",
    "grade": "A",
    "min_percent": 93,
    "max_percent": 100,
    "gpa_points": 4.0,
    "description": "Excellent",
    "source_url": "https://sps.columbia.edu/students/student-advising/academic-policies-procedures/grades",
    "notes": "Common US college percentage cutoffs as compiled in the mygradecalculator.net GPA scale guide from Columbia University School of Professional Studies (A to C-) and the University of the Incarnate Word (D+ to D-, https://my.uiw.edu/registrar/academics/grading-scale.html); standard grade points per George Washington University (https://advising.columbian.gwu.edu/gpa-calculator). Cutoffs, plus/minus use and A+/A- point values vary by institution (e.g. some use 3.67/3.33 thirds)."
  },
  {
    "country": "United States",
    "system": "College letter grades (4.0 GPA, plus/minus)",
    "grade": "A-",
    "min_percent": 90,
    "max_percent": 92,
    "gpa_points": 3.7,
    "description": "Excellent",
    "source_url": "https://sps.columbia.edu/students/student-advising/academic-policies-procedures/grades",
    "notes": "Common US college percentage cutoffs as compiled in the mygradecalculator.net GPA scale guide from Columbia University School of Professional Studies (A to C-) and the University of the Incarnate Word (D+ to D-, https://my.uiw.edu/registrar/academics/grading-scale.html); standard grade points per George Washington University (https://advising.columbian.gwu.edu/gpa-calculator). Cutoffs, plus/minus use and A+/A- point values vary by institution (e.g. some use 3.67/3.33 thirds)."
  },
  {
    "country": "United States",
    "system": "College letter grades (4.0 GPA, plus/minus)",
    "grade": "B+",
    "min_percent": 87,
    "max_percent": 89,
    "gpa_points": 3.3,
    "description": "Good",
    "source_url": "https://sps.columbia.edu/students/student-advising/academic-policies-procedures/grades",
    "notes": "Common US college percentage cutoffs as compiled in the mygradecalculator.net GPA scale guide from Columbia University School of Professional Studies (A to C-) and the University of the Incarnate Word (D+ to D-, https://my.uiw.edu/registrar/academics/grading-scale.html); standard grade points per George Washington University (https://advising.columbian.gwu.edu/gpa-calculator). Cutoffs, plus/minus use and A+/A- point values vary by institution (e.g. some use 3.67/3.33 thirds)."
  },
  {
    "country": "United States",
    "system": "College letter grades (4.0 GPA, plus/minus)",
    "grade": "B",
    "min_percent": 83,
    "max_percent": 86,
    "gpa_points": 3.0,
    "description": "Good",
    "source_url": "https://sps.columbia.edu/students/student-advising/academic-policies-procedures/grades",
    "notes": "Common US college percentage cutoffs as compiled in the mygradecalculator.net GPA scale guide from Columbia University School of Professional Studies (A to C-) and the University of the Incarnate Word (D+ to D-, https://my.uiw.edu/registrar/academics/grading-scale.html); standard grade points per George Washington University (https://advising.columbian.gwu.edu/gpa-calculator). Cutoffs, plus/minus use and A+/A- point values vary by institution (e.g. some use 3.67/3.33 thirds)."
  },
  {
    "country": "United States",
    "system": "College letter grades (4.0 GPA, plus/minus)",
    "grade": "B-",
    "min_percent": 80,
    "max_percent": 82,
    "gpa_points": 2.7,
    "description": "Good",
    "source_url": "https://sps.columbia.edu/students/student-advising/academic-policies-procedures/grades",
    "notes": "Common US college percentage cutoffs as compiled in the mygradecalculator.net GPA scale guide from Columbia University School of Professional Studies (A to C-) and the University of the Incarnate Word (D+ to D-, https://my.uiw.edu/registrar/academics/grading-scale.html); standard grade points per George Washington University (https://advising.columbian.gwu.edu/gpa-calculator). Cutoffs, plus/minus use and A+/A- point values vary by institution (e.g. some use 3.67/3.33 thirds)."
  },
  {
    "country": "United States",
    "system": "College letter grades (4.0 GPA, plus/minus)",
    "grade": "C+",
    "min_percent": 77,
    "max_percent": 79,
    "gpa_points": 2.3,
    "description": "Fair",
    "source_url": "https://sps.columbia.edu/students/student-advising/academic-policies-procedures/grades",
    "notes": "Common US college percentage cutoffs as compiled in the mygradecalculator.net GPA scale guide from Columbia University School of Professional Studies (A to C-) and the University of the Incarnate Word (D+ to D-, https://my.uiw.edu/registrar/academics/grading-scale.html); standard grade points per George Washington University (https://advising.columbian.gwu.edu/gpa-calculator). Cutoffs, plus/minus use and A+/A- point values vary by institution (e.g. some use 3.67/3.33 thirds)."
  },
  {
    "country": "United States",
    "system": "College letter grades (4.0 GPA, plus/minus)",
    "grade": "C",
    "min_percent": 73,
    "max_percent": 76,
    "gpa_points": 2.0,
    "description": "Fair",
    "source_url": "https://sps.columbia.edu/students/student-advising/academic-policies-procedures/grades",
    "notes": "Common US college percentage cutoffs as compiled in the mygradecalculator.net GPA scale guide from Columbia University School of Professional Studies (A to C-) and the University of the Incarnate Word (D+ to D-, https://my.uiw.edu/registrar/academics/grading-scale.html); standard grade points per George Washington University (https://advising.columbian.gwu.edu/gpa-calculator). Cutoffs, plus/minus use and A+/A- point values vary by institution (e.g. some use 3.67/3.33 thirds)."
  },
  {
    "country": "United States",
    "system": "College letter grades (4.0 GPA, plus/minus)",
    "grade": "C-",
    "min_percent": 70,
    "max_percent": 72,
    "gpa_points": 1.7,
    "description": "Fair",
    "source_url": "https://sps.columbia.edu/students/student-advising/academic-policies-procedures/grades",
    "notes": "Common US college percentage cutoffs as compiled in the mygradecalculator.net GPA scale guide from Columbia University School of Professional Studies (A to C-) and the University of the Incarnate Word (D+ to D-, https://my.uiw.edu/registrar/academics/grading-scale.html); standard grade points per George Washington University (https://advising.columbian.gwu.edu/gpa-calculator). Cutoffs, plus/minus use and A+/A- point values vary by institution (e.g. some use 3.67/3.33 thirds)."
  },
  {
    "country": "United States",
    "system": "College letter grades (4.0 GPA, plus/minus)",
    "grade": "D+",
    "min_percent": 67,
    "max_percent": 69,
    "gpa_points": 1.3,
    "description": "Poor but passing",
    "source_url": "https://sps.columbia.edu/students/student-advising/academic-policies-procedures/grades",
    "notes": "Common US college percentage cutoffs as compiled in the mygradecalculator.net GPA scale guide from Columbia University School of Professional Studies (A to C-) and the University of the Incarnate Word (D+ to D-, https://my.uiw.edu/registrar/academics/grading-scale.html); standard grade points per George Washington University (https://advising.columbian.gwu.edu/gpa-calculator). Cutoffs, plus/minus use and A+/A- point values vary by institution (e.g. some use 3.67/3.33 thirds)."
  },
  {
    "country": "United States",
    "system": "College letter grades (4.0 GPA, plus/minus)",
    "grade": "D",
    "min_percent": 63,
    "max_percent": 66,
    "gpa_points": 1.0,
    "description": "Poor but passing",
    "source_url": "https://sps.columbia.edu/students/student-advising/academic-policies-procedures/grades",
    "notes": "Common US college percentage cutoffs as compiled in the mygradecalculator.net GPA scale guide from Columbia University School of Professional Studies (A to C-) and the University of the Incarnate Word (D+ to D-, https://my.uiw.edu/registrar/academics/grading-scale.html); standard grade points per George Washington University (https://advising.columbian.gwu.edu/gpa-calculator). Cutoffs, plus/minus use and A+/A- point values vary by institution (e.g. some use 3.67/3.33 thirds)."
  },
  {
    "country": "United States",
    "system": "College letter grades (4.0 GPA, plus/minus)",
    "grade": "D-",
    "min_percent": 60,
    "max_percent": 62,
    "gpa_points": 0.7,
    "description": "Poor but passing; lowest passing grade on this scale",
    "source_url": "https://sps.columbia.edu/students/student-advising/academic-policies-procedures/grades",
    "notes": "Common US college percentage cutoffs as compiled in the mygradecalculator.net GPA scale guide from Columbia University School of Professional Studies (A to C-) and the University of the Incarnate Word (D+ to D-, https://my.uiw.edu/registrar/academics/grading-scale.html); standard grade points per George Washington University (https://advising.columbian.gwu.edu/gpa-calculator). Cutoffs, plus/minus use and A+/A- point values vary by institution (e.g. some use 3.67/3.33 thirds)."
  },
  {
    "country": "United States",
    "system": "College letter grades (4.0 GPA, plus/minus)",
    "grade": "F",
    "min_percent": 0,
    "max_percent": 59,
    "gpa_points": 0.0,
    "description": "Failure",